,0
"Треться вовна об вовну, біла об чорну, хвилюють пухнаті хребти, як дрібні в озері хвилі, і драгліє отара.- Птруа… птруа!…- Горляний поклик все навертає крайніх в отару, тримає повідь у берегах.",1
"Гори голубіють навколо, як море, вітер громадить на небі хмари.",1
"Тремтять кучеряві овечі хвости, а голови всі нахилились, і білі плескаті зуби вигризають у корінь солодку бриндушу, храбуст або рожевий горішок.- Бир!",1
"Бир!…- Стелить отарі під ноги полонина свій килим, а вона накриває її рухомим рябим кожухом.",0
"Хрум-хрусь… Бе-е… ме-е!… Хрусь-хрусь… Тіні од хмар бродять по ближчих горбах, пересувають їх з місця на місце.",-1
"Ходять, здається, гори, як вали в морі, і тільки далекі непорушно голубіють на місці.",0
"Сонце залляло овечу вовну, розклавшись веселкою в ній, запалило трави зеленим вогнем, за вівчарями ідуть довгі їх тіні.- Птруа… Птруа!…-Хрум-хрусь… хрусь-хрусь… Нечутно ступають пастухи в постолах, котиться м'яко вовниста хвиля по полонині, а вітер почина грати на далекім воринні.",-1
"Дз-з…- тонко співає він в одколоту скалку, докучно бринить, як муха.",1
"Дз-з…- обзивається грубо друге вориння, наводячи сум.",-1
Хмари все прибувають.,-1
"Вони вже закрили півнеба, гасне далекий Бескид, і чорніє, і похмурніє в тінях, немов удівець, а полонина ще молодіє.",0
"І питається вітер тонко в воринні: ""Чому ти ся бай не жениш, високий Бескиде?""",1
"-""Бо зелена полонинка за мене не піде"",- сумно зітхає Бескид.",-1
"Блакитне небо замазалось сірим, море гір потемніло, полонина погасла, і отара овець повзе по ній, як сірий лишай.",-1
Холодний вітер розправля крила і б'є ними у груди попід кептар.,0
"Так трудно дихать, що хочеться обернутись до нього спиною.",0
"Хай б'є… Тонко заводить вориння, як муха в тенетах, скиглить біль нестерпучий, плаче самотній сум… Дз-з… дзи-и… Невгавуче, безперестанку.",-1
Висотує жили і крає ножем по серці.,0
"Хтів би не слухать, але не можна, хтів би втекти - та де?",0
Гісь-гісь!… А ти куди?… Шляг би ті трафив!,0
Бир-бир!… Мурко!… Але Мурко вже навертає.,0
"Обганяє вівцю, вітер настовбурчив на ньому шерсть, а він зловив вже зубами за карк вівцю і кинув в отару.",1
Дз-з-и и… Дз-зі-і-і… Так зуби болять одноманітним і нестерпучим болем.,-1
Зціпив би зуби й замовк.,0
Боли.,0
"Дзичи, пек ті та цур!",0
Що воно плаче?,-1
"Відай, се ""той"", бодай скаменів!… Отак, здається, впав би на землю, безсилий, затулив вуха руками та би заплакав… Бо вже не годен… Дз-з-и-и… Дзі-у-у!… Йой!…

Іван виймає флояру і дме у неї що має сили, але ""той"", навіжений, сильніший за нього.",0
"Летить од Чорногори, як розгнузданий кінь, б'є копитами трави і розмечує гривою згуки флояри.",0
"А Чорногора, мов відьма, блима за ним більмом - сніговим полем з-під чорних розпатланих кіс і лякає.",-1
"Дз-и-и… Дзі-у-у!…

Закотилися вівці в долинку, і тут тихіше.",0
На сірому небі показалось блакитне озерце.,1
Остра полонинська трава сильніше запахла.,1
Озерце в небі виступа з берегів і вже широко розлило води.,1
"Заголубіли знову верхи, а всі долини налились золотом сонця.",1
Іван дивиться вниз.,0
"Там десь, між горами, де люди, по зеленій отаві походжають білі ноги Марічки.",0
її очі звернені десь на полонину.,0
Чи співає свої співанки?,0
"А може, справді порозсівала по горах, вони зійшли квітками, а Марічка замовкла?",0
"Ой як будуть вівчарики
Білі вівці пасти,
Будуть мої співаночки
За кресаню класти…-
згадується йому милий дівочий голос, і він зриває квітку та закосичує нею кресаню.",1
Птруа… птруа… Сонце пече.,0
Робиться душно.,0
"Котяться вівці, пирхають на бігу, кривлять старечі губи, щоб краще стяти зубами солодкий храбуст, та лишають по собі свіжі бабельки.",1
"Хрусь-хрусь… хрум-хрум… Треться вовна об вовну, біла об чорну, хвилюють хребти, як в озері хвильки… Бе-е… ме-е… а собаки усе тримають отару у берегах.",1
Потомились вівчарки.,0
Лягають і носять боками в траві.,-1
"На довгий червоний язик, що звиса між іклами, сідають мухи.",-1
- Бир-бир!,0
"- сердито гукає Іван, і вже собаки при вівцях.",0
"Далеко, на полонині, під густим лісом, пасуться корови.",0
Бовгар([19]) сперся в задумі на довгу трембіту.,-1
Так поволі тягнеться час.,0
"Гірське повітря прополоскало груди, хочеться їсти.",0
І як самотньо!,-1
"Стоїш тут маленький, як бадилина у полі.",0
"Під ногами зелений острів, що його обливають блакитні води далеких гір.",0
"А там, по суворих диких верхах, десь у безводах, в безслихах, гніздиться всяка мара, ворожа сила, з якою тяжко боротись.",-1
"Лиш одно - сокотися…

Гісь-гісь!",0
"Трусяться вівці зеленим полем, м'яко ступають по траві постоли… Тиша така, що чутно, як кров тече в жилах… Сон налягає.",0
"Кладе м'якеньку лапу на очі і на лице і шепче до вуха: спи… Вівці тануть перед очима… от вже з овець стали ягнята, а от нічого нема.",0
"Поплили трави, як зелена вода.",0
Приходить Марічка.,0
"Ой не обдуриш, небого, ой ні… Іван знає, що то лісна, а не Марічка, що то вона надить його.",0
Щось тягне його за нею!,0
"Не хоче, а вже пливе, як пливуть трави зеленим потоком…

І раптом дике передсмертне ревіння корови викидав його зі сну.",-1
Що?,0
Де?,0
"Бонгар як стояв, опершись трембітою в землю, так і застиг.",0
"Рудий бугай вдарив ногами в землю, зігнув воласту шию і підняв хвіст.",-1
"Він вже мчить на той крик, високо скаче і рве ногами траву.",-1
Ріже ногами повітря.,0
Бовгар стрепенувся і поспішав за ним до лісу.,0
Бахнув у лісі стріл.,0
Бах-бах-бах…- загриміли з рушниць верхи.,0
"Бах-бах-бах…- озвались дальші, і все німів.",0
Тиша.,0
"""Певно, ""вуйко"" зарізав корову"",- дума Іван і пильніше оглядає свою отару.",0
"- Птруа-птруа…- Сонце наче заснуло, вітер затих і перенісся з землі на небо.",1
"Він вже громадить там хмари, таке саме збурене море верхів, яке бачив круг полонини.",-1
"В безконечних просторах загинув час, і не знати, чи день стоїть, чи минає…

Раптом до вуха долітав давно жданий поклик трембіти.",-1
"Він приносить од стаї запах кулеші та диму і довгим мелодійним тремтінням оповідав, що кошари чекають на вівці…

- Гісь-гісь…- Мечуться пси, блеють овечки і ллються перистим потоком в долину, трясучи вим'ям, обважнілим од молока…

x x x
Вже третю добу сів на полонині дрібний мачкатий дощик.",-1
"Закурились верхи, закуталось небо, і в сірій мряці пропали гори.",0
"Вівці ледве ходили, важкі, повні водою, як губка; одежа на вівчарях стала холодна й цупка.",-1
"Тільки й спочинку було, що під дашком у струнці([20]) під час доїння.",0
"Іван сидить, опершись плечима в дошку, а ногами стискає дійницю.",0
"Біля нього - чорний пелехатий козар([21]), що за кожним словом клене, а там ще вівчарі.",0
"Нетерплячі дроб'єта, яким прибува молоко, пруться з загороди у струнку, щоб їх швидше здоїли.",1
"Але ж бо почекайте, сараки, бо так не йде… Лиш по одній…

- Рист!",0
- сердито кидає ззаду гонінник в овечий лемент та хльоска мокрим прутом.- Рист!,-1
"Рист!…- підбадьорюють вівчарі та одхиляють коліна од дірки, кудою скаче у струнку вівця.- А!",-1
Бодай бис…- клене козар і не кінчає: ану скажеш в таку годину!,0
Навиклим рухом Іван хапа вівцю за хребет і тягне до себе задом понад широку дійницю.,1
"Покірно стоїть вівця, невигідно розчепіривши ноги, гака дурна, і слуха, як дзюрить з неї молоко у дійницю.- Рист!",-1
- хльоска ззаду гонінник.- Рист!,0
Рист!,0
- покликують і собі вівчарі.,0
"Здоєні вівці, немов стуманілі, падають в загороді на камінь, кладуть голову на лапки і кривлять голі старечі губи.- Рист!",-1
"Рист!…- Іванові руки безперестанку мнуть тепле овече вим'я, одтягають дійки, а по руках в нього тече молоко, що пахне лоєм і підіймає з дійниці масну солодку пару.",0
- Рист!,0
"- Вскакують вівці як очманілі, розчепірюють над дійницями ноги, і десять вівчарських рук мнуть тепле вим'я.",0
"Жалібно плаче мокра отара по сей і той бік струнки, падають в загороду знесилені вівці, а густе молоко дзвінко дзюрить в дійницю та затікає теплим струмочком аж за рукав.- Рист!",-1
"Рист!…

Козар сміється очима до своїх кіз.",0
"Вони не те, що овечки, в них гостре серце.",1
"Не падають трупом, як плохі вівці, а твердо стоять на тоненьких ногах.",0
"Цікаво підняли ріжки і дивляться в мряку, наче крізь неї щось бачать, і так бадьоро трясуться у них тоненькі борідки…

x x x
Опустіли кошари.",0
Тиша і пустка.,0
"Може, там десь в глибоких долинах, звідки гори починають рости, і лунають сміх людський та голоси, але у се віриться мало.",1
"Тут, в полониш, де небо накриває безлюдні простори, що живуть в самотині тільки для себе, вікує тиша.",0
Лиш в стаї тріщить невгасимий погонь і все висилає синій дим свій на мандри.,-1
"Здоєне молоко важко спочиває в дерев'яній посуді, над ним схилився ватаг.",-1
Він вже його заправив.,0
"З подри([22]), де сохнуть великі круглі боханці будзу, повіває на ватага вітер, але не може прогнати зі стаї запаху вугля, сиру і овечої вовни.",1
Бо тим самим пахне і ватаг.,0
"Нові бербениці й барильця німують в кутку, хоч тільки запукай до них - і обізветься голос, що там жиє.",1
Холодна жентиця([23]) світить з коновки зеленим оком.,-1
"Ватаг сидить серед свого начиння, як батько серед дітей.",0
"Все воно - чорні лавки і стіни, ватра і дим, будз, бербериці й жентиця,- все воно близьке і рідне, на всьому спочила його тепла рука.",-1
"Молоко вже гусне, але ще йому не пора.",0
Тоді ватаг вийма з-за череса цілий жмуток дерев'яних колодок і починав читати.,0
"Там закарбовано все, в тій дерев'яній книзі, хто скільки має овець і що кому належить.",0
"Турбота зсува йому брови, а він уперто чита: ""Мосійчук має штирнадцять дроб'ет, а му належит…""

За стінкою стаї спузар виводить:

Питається у баранця
Круторіжка вівця:
Ци ти вробиш, баранчику,
Зеленого сінця?",-1
- Розспівався!,0
- сердиться ватаг і наново перелічує карби.,0
"Не знаєш ти, круторіжко,
Яка буде зима,
Ци ти вийдеш, ци не вийдеш
З полонинки жива, -
докінчує спузар у сінях і входить в стаю.",1
"Закопчений, чорний, згинається над вогнем, і білі зуби блищать у нього.",0
Вогонь потріскує стиха.,0
Молоко в путині жовкне і гусне.,0
"Ватаг схилився над ним скуплений, навіть суворий.",-1
"Розщібає поволі рукава і по сам лікоть занурює в нього свої голі, зарослі волоссям руки.",0
"І так застигає над молоком…

Тепер має бути тихо у стаї, двері замкнені, і навіть спузар не сміє кинуть оком на молоко, поки там твориться щось, поки ватаг чаклує.",0
"Все наче застигло в німому чеканні, бербениці затаїли у собі голос, притаїлись будзи на полицях, поснули сном чорним стіни і лави, вогонь ледве диха, і навіть дим соромливо тікає в вікно.",-1
"Тільки по легкому рухові жил на ватагових руках помітно, що насподі в посуді одбувається щось.",1
"Руки оживають потроху, то підіймаються вище, то опускаються нижче, закруглюють лікті, щось плещуть, бгають та гладять там всередині, і раптом з дна посуди, з-під молока, підіймається кругле сирове тіло, що якимсь чудом родилось.",-1
"Воно росте, обертає плескаті боки, купається в білій купелі, само біле і ніжне, і коли ватаг його виймає, зелені родові води дзвінко стікають в посуду…

Ватаг легко зітхнув.",1
Тепер і спузар може вже глянуть.,0
"Славний родився будз, ватагові на втіху і на пожиток людям…

Одчиняються двері нарозтіж, вітер дме з подри, ватра з радості лиже чорний котел, в якому сироватка Єуля коломийки, і серед диму й вогню блищать в спузаря зуби…

А коли сонце заходить, ватаг виносить зі стаї трембіту і трубить побідно на всі пустинні гори, що день скінчився миром, що будз йому вдався, кулеша готова і струнки чекають на нове молоко…

x x x
За своє літування у полонині зазнав Іван немало пригод.",1
Раз він побачив дивну картину.,0
"Мав уже гнати вівці до стаї, коли ненароком озирнувся на близький верх.",0
"Мряка знизилась і укутала ліс, а він став легкий і сивий, як привид.",1
Тільки полянка зеленіла під ним та чорніла одинока смерека.,0
І ось та смерека закурилась і почала рости.,0
Росте та й росте - і ось виступив з неї якийсь чоловік.,0
"Став на полянці, білий, високий, і гукнув назад себе у ліс.",-1
"І зараз вийшли з лісу олені, один за другим, а що вийде новий, то роги у нього все кращі та веселіші.",1
"Гуртом вибігли серни, потремтіли на тоненьких ногах та й почали щипати траву.",0
"А що розсиплються серни, то ведмідь їх заверне, отак як вівці вівчарка.",0
А той білий пасе - ще й погейкує на худібку.,0
"Тут раптом звівся вітер, а то стадо як пирсне, так і пропало.",0
"Отак як би хукнув на скло, воно за пітніє, а потому щезне усе, наче нічого не було.",0
"Він показував іншим, але ті дивувалися: ""Де?",1
"Сама лиш мряка"".",0
"За два тижні ""великий"" - так вівчарі пошепки називали ведмедя - зарізав ще п'ять корів.",1
Часто негура([24]) заставала вівці у полонині.,0
"У густій мряці, білій, як молоко, все пропадало: небо, гори, ліси, пастухи.- Г-ей!",1
- кликав Іван перед себе.- Г-ей!,0
"- відзивалось глухо на його поклик, як з-під води, а звідки, де був той, що кричав,- невідомо.",0
"Вівці сивим туманом котились попід ногами, а далі пропадали й вони.",-1
"Іван йшов безпомічний, простягти руки перед собою, наче боявся на щось наткнутись, і кликав: - Гей!…- Де ти?",-1
- обзивалось вже ззаду - і Іван мусив ставати.,0
"Стояв безпорадний, згублений у липкому тумані, і коли прикладав до уст трембіту, щоб обізватись, другий кінець трембіти розпливався у мряці, а здушений голос її, тут же на місці, падав йому під ноги.",-1
Так вони розгубили кілька овечок.,0
"""Вуйко"" роздер ще дві корови, але то було востаннє: добирався вночі до стаї та й настромився на кіл.",0
Тепер його шкура сушиться на кілках і на неї брешуть собаки.,0
Часом била на полонині плова.,0
Святий Ілля воювавсь з тими - цур їм та пек!,1
Так блискав мечем і так гримав з рушниці - свят єси господи!,0
"- що лупилося небо та западало на гори, а щойно лусне, то щось чорне за кожним разом зів'єся туди-сюди - та й шусть під камінь… Він, щез би, глумиться богові, підставляє, свою гузицю, а вівчареві біда: страху набереться, ще й змокне до нитки…

У петрівку упали зими - і то такі тяжкії, що три дні не сходив сніг.",-1
"Тоді розчахнулось багато овечок…

Зрідка приходили люди з долини, їх обступали, питаючись навперейми:

- Що чути селом?",1
"І, як ті діти, слухали прості оповідання про те, скільки люди вробили сіна, що буришки([25]) нема, кукурудзи ріденькі, а Мочарникова Ілена померла.",0
"Потому всі разом пили за здоров'я маржинки, гості набирали у бербениці бриндзи та в мирності знову спускались в долини.",0
Вечорами біля стаї палали вогні.,0
"Вівчарі скидали з себе одежу та трусили над ними воші або, зібравшись докупи, зголоднілі за літо без ""челядини"", вели безконечні масні розмови.",0
Їх регіт покривав навіть сонні зітхання худоби.,0
"Іван, перше ніж облягатись, кликав до себе Миколу, завжди співучого і говіркого.",1
"- Мико!… Ходи д'мені, браччіку!…

- Почекай, браччіку Йва, я зараз!",0
