,0
Михайло Коцюбинський.,0
"Тіні забутих предків
Іван був дев'ятнадцятою дитиною в гуцульській родині Палійчуків.",-1
Двадцятою і останньою була Анничка.,0
"Не знати, чи то вічний шум Черемошу і скарги гірських потоків, що сповняли самотню хату на високій кичері([1]), чи сум чорних смерекових лісів лякав дитину, тільки Іван все плакав, кричав по ночах, погано ріс і дивився на неню таким глибоким, старече розумним зором, що мати в тривозі одвертала од нього очі.",-1
"Не раз вона з ляком думала навіть, що то не од неї дитина.",0
"Не ""сокотилася"" баба при злогах, не обкурила десь хати, не засвітила свічки - і хитра бісиця встигла обміняти її дитину на своє бісеня.",-1
"Туго росла дитина, а все ж підростала, і не стямились навіть, як довелося шить їй штани.",0
Але так само була чудна.,0
"Дивиться перед себе, а бачить якесь далеке і не відоме нікому або без причини кричить.",1
"Гачі([2]) на йому спадають, а воно стоїть серед хати, заплющило очі, роззявило рота і верещить.",0
"Тоді мати виймала люльку з зубів і, замахнувшись на нього, люто гукала:

- Ігі на тебе!",-1
"Ти, обмініннику.",0
"Щез би у озеро та в тріски!…

І він щезав.",0
"Котивсь зеленими царинками([3]), маленький і білий, наче банька кульбаби, безстрашно забирався у темний ліс, де гаджуги([4]) кивали над ним галузками, як ведмідь лабами.",-1
"Звідси дивився на гори, близькі й далекі верхи, що голубіли на небі, на смерекові чорні ліси з їх синім диханням, на ясну зелень царинок, що, мов дзеркала, блищали в рамах дерев.",1
"Під ним, в долині, кипів холодний Черемош.",-1
По далеких горбах дрімали на сонці самотні оселі.,-1
"Були так тихо і сумно, чорні смереки безперестанку спускали сум свій в Черемош, а він ніс його долом й оповідав.",-1
- Іва!… Мо-ой!,0
"- гукали на Івана од хати, але він того не слухав, збирав малини, пукав з листочків, робив свистілку або пищав у травинку, намагаючись вдати голоси птахів та всі ті згуки, що чув у лісі.",-1
"Ледве помітний в лісовім зелі, збирав квітки і косичив ними свою кресаню (бриль), а утомившись, лягав десь під сіном, що сохло на остривах([5]), і співали йому до сну та й будили його своїм дзвоном гірські потоки.",-1
"Коли Іванові минуло сім літ, він уже дивився на світ інакше.",1
Він знав вже багато.,1
"Умів знаходити помічне зілля - одален, матриган і підойму, розумів, про що канькає каня, з чого повстала зозуля, і коли оповідав про все те вдома, мати непевно позирала на нього: може, воно до нього говорить?",0
"Знав, що на світі панує нечиста сила, що арідник (злий дух) править усім; що в лісах повно лісовиків, які пасуть там свою маржинку([6]): оленів, зайців і серн; що там блукає веселий чугайстир, який зараз просить стрічного в танець та роздирає нявки; що живе в лісі голос сокири.",1
"Вище, по безводних далеких недеях([7]), нявки розводять свої безконечні танки, а по скелях ховається щезник.",-1
"Міг би розказати і про русалок, що гарної днини виходять з води на берег, щоб співати пісень, вигадувать байки і молитви, про потопельників, які по заході сонця сушать бліде тіло своє на каменях в річці.",-1
"Всякі злі духи заповнюють скелі, ліси, провалля, хати й загороди та чигають на християнина або на маржину, щоб зробити їм шкоду.",-1
"Не раз, прокинувшись уночі, серед ворожої тиші, він тремтів, сповнений жахом.",-1
"Весь світ був як казка, повна чудес, таємнича, цікава й страшна.",1
Тепер він вже мав обов'язки - його посилали пасти корови.,0
"Гнав в ліс своїх жовтаню та голубаню, і коли вони потопали в хвилях лісових трав та молодих смеречок і вже звідти обзивались до нього, як з-під води, тужливим дзвоном своїх дзвінків, він сідав десь на узбіччі гори, виймав денцівку (сопілку) і вигравав немудрі пісні, яких навчився од старших.",1
Однак та музика не вдовольняла його.,0
"З досадою кидав денцівку і слухав інших мелодій, що жили в ньому, неясні і невловимі.",0
"Знизу підіймавсь до Івана і затоплював гори глухий гомін ріки, а в нього капав од часу до часу прозорий дзвін колокільця.",0
"З-за галузки смереки виглядали зажурені гори, напоєні сумом тіней од хмар, що все стирали бліду усмішку царинок.",-1
"Гори щохвилини міняли свій настрій: коли сміялась царинка, хмурився ліс.",0
"І як трудно було вдивитись в те рухливе обличчя гір, так трудно було дитині спіймати химерну мелодію пісні, що вилась, тріпала крильцями коло самого вуха і не давалась.",1
Одного разу він покинув свої корови і подряпавсь на самий грунь (верх).,0
"Ледве помітною стежкою підіймавсь вище і вище, поміж густі зарослі блідої папороті, колючої ожини й малини.",-1
"Легко перескакував з камінця на камінчик, перелазив через повалені дерева, продирався крізь гіллячки кущів.",1
"За ним підіймався з долини вічний шум річки, росли гори, і вже вставав на крайнебі блакитний привид Чорногори.",0
"Довгі плакучі трави крили тепер боки гори, дзвінки корів обзивались, як далеке зітхання, все частіше попадалось велике каміння, що далі, на самім вершку, творило хаос поламаних скель, списаних лишаями, здушених у гадючих обіймах корінням смерек.",-1
"Під ногами в Івана кождий камінь вкривали рудаві мхи, грубі м'які, шовкові.",-1
"Теплі і ніжні, вони ховали у собі позолочену сонцем воду літніх дощів, м'яко вгинались і обіймали ногу, як пухова подушка.",1
"Кучерява зелень гогозів і афин([8]) запустила своє коріння у глибінь моху, а зверху сипнула росою червоних та синіх ягід.",0
Тут Іван сів одпочити.,0
"Ніжно дзвеніла над ним хвоя смерек, змішавшись з шумом ріки, сонце налляло злотом глибоку долину, зазеленило трави, десь курився синій димок од ватри([9]), з-за Ігриця оксамитовим гулом котився грім.",0
"Іван сидів і слухав, забувши зовсім, що має доглядати корови.",0
"І ось раптом в сій дзвінкій тиші почув він тиху музику, яка так довго і невловимо вилась круг його вуха, що навіть справляла муку!",-1
"Застиглий і нерухомий, витягнув шию і з радісним напруженням ловив дивну мелодію пісні.",-1
"Так люди не грали, він принаймні ніколи не чув.",-1
Але хто грав?,-1
"Навкруги була пустка, самотній ліс і не видно було живої душі.",0
"Іван озирнувся назад, на скелі, - і скаменів.",-1
"На камені, верхи, сидів ""той"", щезник, скривив гостру борідку, нагнув ріжки і, заплющивши очі, дув у флояру.",1
"""Нема моїх кіз… Нема моїх кіз…"" - розливалась жалем флояра.",-1
"Та ось ріжки піднялись вгору, щоки надулись і розплющились очі.",0
"""Є мої кози… Є мої кози…"" - заскакали радісно згуки, і Іван з жахом побачив, як, виткнувшись з-за галузок, затрясли головами бородаті цапи.",0
Він хтів тікати - й не міг.,-1
"Сидів прикутий на місці і німо кричав од холодного жаху, а коли врешті видобув голос, щезник звинувся і пропав раптом у скелі, а цапи обернулись в коріння дерев, повалених вітром.",-1
"Іван гнав тепер вниз, без тями, наосліп, рвав зрадливі обійми ожин, ламав сухі гіллячки, котився по слизьких мхах і з жахом чув, що за ним щось женеться.",-1
Нарешті впав.,0
"Скільки лежав, не пам'ятає.",-1
"Прийшовши до себе і вздрівши знайомі місця, він заспокоївся трохи.",0
"Здивований, наслухав якийсь час.",0
"Пісня, здавалось, бриніла вже в ньому.",-1
Він вийняв денцівку.,0
"Зразу йому не йшло, мелодія не давалась.",0
"Починав грати спочатку, напружував пам'ять, ловив якісь згуки, і коли врешті знайшов, що віддавна шукав, що не давало йому спокою, і лісом поплила чудна, не відома ще пісня, радість вступила у його серце, залляла сонцем гори, ліс і траву, заклекотіла в потоках, підняла ноги в Івана, і він, пожбурнувши денцівку в траву та взявшись у боки, закрутився в танці.",1
"Перебирав ногами, ставав легко на пальці, бив босими п'ятами в землю, щібав голубці, крутився і присідав.",1
"""Є мої кози… Є мої кози…"" - щось співало у ньому.",0
"На сонячній плямі полянки, що закралась в похмуре царство смерек, скакав біленький хлопчик, немов метелик пурхав зі стебла на стеблину, а обидві корови - жовтаня і голубаня, просунувши голови межи галузки, привітно дивились на нього, жуючи жуйку, та зрідка дзвонили йому до танцю.",-1
"Так знайшов він у лісі те, чого шукав.",0
"Вдома, в родині, Іван часто був свідком неспокою і горя.",-1
"За його пам'яті вже двічі коло їх хати трембітала трембіта([10]), оповіщаючи горам і долам про смерть: раз, коли брата Олексу роздушило дерево в лісі, а вдруге, коли браччік Василь, файний веселий леЄінь, загинув у бійці з ворожим родом, посічений топірцями.",-1
Се була стара ворожнеча між їхнім родом і родом Гутенюків.,-1
"Хоч всі в родині кипіли злістю й завзяттям на той диявольський рід, але ніхто не міг докладно розказати Іванові, звідки пішла ворожнеча.",-1
"Він теж горів бажанням помститись і хапавсь за татову бартку, важку ще для нього, готовий кинутись в бій.",-1
"То байка, що Іван був дев'ятнадцятий в батька, а Анничка двадцята.",0
Їхня родина була невелика: старині двоє та п'ятеро дітей.,-1
Решта п'ятнадцять спочило на цвинтарі біля церковці.,0
"Всі вони були богомільні, любили ходити до церкви, і особливо на храм.",1
"Там можна побачитись було з далеким родом, що осівся по околишніх селах, та й траплялась нагода оддячить Гутенюкам за смерть Василеву та за ту кров, що не раз чюрила з Палійчуків.",0
"Витягалось найкраще лудіння (одежа), нові крашениці, писані кептарі, череси і табівки, багато набивані цвяхом, дротяні запаски, черлені хустки шовкові і навіть пишна та білосніжна гугля, яку мати обережно несла на ціпку через плече.",1
"Іван теж дістав нову кресаню і довгу дзьобню, що била його по ногах.",0
"Сідлались коні, і суточками([11]) зеленим верхом ішов пишний похід та закосичував плай гейби червоним маком.",1
"По горах, долами й верхами, тяглися святочно прибрані люди.",0
"Зелена отава царинок розцвіталася раптом, вздовж Черемошу плив різнобарвний потік, а десь високо, на чорному запиналі смерекових лісів, жаром горів під ранішнім сонцем червоний дашок гуцульського парасоля.",-1
Незабаром Іван побачив стрічу ворожих родів.,-1
"Вони вже вертали з храму, тато був трохи напитий.",0
"Раптом на вузенькій дорозі, між скелею і Черемошем, зробився тиск.",-1
"Вози, кінні і піші, чоловіки й жінки - спинились і збились в купу.",0
"В лютому Євалті, що звіявсь одразу, як вихор, невідомо од чого, заблищали залізні бартки та заскакали перед самим обличчям.",-1
"Як кремінь і криця, стялись роди- Гутенюки з Палійчуками, і перше ніж Іван встиг розібрати, про що їм йдеться, тато розмахнув бартку і вдарив плазом комусь по чолі, з якого бризнула кров, залляла лице, сорочку та пишний кептар.",1
"Йойкнула челядь([12]), кинулась одтягати.",0
"а вже людина з лицем червоним, як його гачі, тяла барткою ворога в голову, і похитнувся Іванів тато, як підтята смерека.",-1
Іван кинувся в бійку.,-1
"Не пам'ятав, що робить.",0
Щось підняло його.,0
"Але дорослі потолочили йому ноги, і він не міг протиснутись туди, де бились.",-1
"Все ще гарячий, роз'юшений злістю, він наскочив з розгону на маленьке дівча, що тряслось з жаху біля самого воза.",-1
Ага!,0
"Се, певно, Гутенюкова дівка!",0
"І, не думавши довго, ударив її в лице.",0
"Вона скривилась, притулила руками до грудей сорочку і почала тікати.",-1
"Іван зловив її коло ріки, шарпнув за пазуху і роздер.",0
"Звідти впали на землю нові кісники, а дівчинка з криком кинулась їх захищати.",1
Але він видер і кинув у воду.,0
"Тоді дівчинка, зігнута вся, подивилась на нього спідлоба якимсь глибоким зором чорних матових очей і спокійно сказала:

- Нічьо… В мене є другі… май ліпші.",0
Вона наче його потішала.,0
"Здивований лагідним тоном, хлопець мовчав.",0
"- Мені неня купила нову запаску… і постоли… і мережані капчурі… і…

Він все ще не знав, що сказати.",1
"- Я си обую файно та й буду дівка…

Тоді йому заздрісне стало.",0
- А я вже вмію грати в денцівку.,-1
"- Наш Федір зробив си таку файну флояру… та й як зайграє…

Іван надувся.",0
- Я вже щезника бачив.,0
Вона неймовірно подивилась на нього.,1
- А наш о ж ти б'єш си?,0
- А ти нашо коло воза стояла?,0
"Вона подумала трохи, не знаючи, що одповісти, і почала шукать щось за пазухою.",0
Витягла врешті довгий цукерок.,-1
- Ади!,0
"Половину вкусила, а другу поважним, повним довір'я рухом подала йому.",1
- На!,0
"Він завагався, але узяв.",0
"Тепер вони вже сиділи рядочком, забувши про вереск бійки й сердитий шум річки, а вона оповідала йому, що зветься Марічка, що пасе вже дроб'єта (вівці), що якась Марцинова - сліпа на одно око - покрала у них муку… і таке інше, обом цікаве, близьке і зрозуміле, а погляд її чорних матових очей м'яко поринав у Іваново серце…

І втретє затрембітала трембіта про смерть в самотній хаті на високій кичері: другого дня по бійці помер старий Палійчук.",-1
Тяжкі часи настали в родині Івана по смерті Єазди.,-1
"Загніздилось безладдя, спливали гаразди, продавались царинки одна по одній, і маржина десь танула так, як по горах весною сніги.",-1
"Але в Івановій пам'яті татова смерть не так довго жила, як знайомість з дівчам, що, скривджене ним безневинно, повним довір'я рухом подало йому половину цукерка.",-1
В його давній і безпричинний смуток влилась нова течійка.,0
"Вона несвідомо тягла його в гори, носила по сусідніх кичерах, лісах і долинах, де б він міг стріти Марічку.",-1
І він стрівся нарешті з нею: пасла ягнята.,0
"Марічка його прийняла, як би давно сподівалась: він буде з нею пасти овечки.",0
А й справді!,0
"Нехай жовтаня та голубаня для себе б'ють в колокільці та вирікують в лісі, а він йме пасти її ягнята.",0
І як вони пасли!,0
"Білі ярки, забившись у холодок під смереку, дивились дурними очима, як качались по мхах двоє дітей, дзвонячи в тиші молодим сміхом.",-1
"Втомившись, вони забирались на біле каміння і лячно зазирали звідти у прірву, з якої стрімко підіймався у небо чорний привид гори і дихав синню, що не хтіла тануть на сонці.",1
В щілині поміж горами летів в долину потік і тряс по каміннях сивою бородою.,-1
"Так було тепло, самотньо і лячно у віковічній тиші, яку беріг ліс, що діти чули власне дихання.",0
"Але вухо уперто ловило і побільшало до найбільших розмірів усякий згук, що мусив жить в лісі, і їм часом здавалось, що вони чують чийсь хід потайний, глухе гупання барди, хекання втомлених грудей.",-1
"- Чуєш, Іва?",0
- шепотіла Марічка.,0
- Чому б не мав чути?,0
А чую.,0
"Вони обоє знали, що то бродить по лісі невидима сокира, гупа об дерева і хека з втомлених грудей.",-1
"Ляк проганяв їх звідти в долину, де потік плив спокійніше.",-1
"Вони робили собі курбало у потоці, глибоке місце, і, роздягшись, бовтались в нім, як двоє лісних звірят, що не знають, що таке сором.",-1
"Сонце спочивало на їх яснім волоссі і било в очі, а льодова вода потоку щипала тіло.",0
Марічка перша змерзала і пускалася бігти.,0
"- Стій,- гукав на неї Іван,- звідки ти?",0
"- З Я-вор-рова,- цокотіла зубами синя Марічка.",0
- А чия ти?,0
- Ковальова.,0
"- Бувай здорова, ковальова!",1
"- щипав її Іван і пускавсь доганяти, аж поки потомлені, але загріті, не падали на траву.",-1
