,0
"- гукав од стаї спузар, і вже звідти долітала до Івана його співанка:

Чорногора хліб не родить,
Не родить пшеницю,
Викохує вівчариків,
Сирок і жентицю…
Микола був сиротою і виріс у полонині.",-1
"""Плекали мя вівці"",- говорив він про себе, пригладжуючи непокірні кучерики.",1
"Упоравшись, лягав спузар біля Івана, весь чорний, пересичений димом, й блищав молодими зубами при вогні ватри.",0
"Іван присувався ближче до нього, ловив Миколу за шию й прохав:

- Оповіж, браччіку, казку якус, ти їх багато знаєш…

З чорного неба капали зорі, й пливла по ньому білим шумом небесна ріка.",1
В долинах дрімали гори.,0
"- Відай, ростут,- кидав наче до себе Іван.",0
- Хто?,0
- Гори.,0
"- Перше росли, тепер перестали…

Микола мовкне, але потім додає стиха:

- З первовіку не було гір, лише вода… Така вода, гейби море без берегів.",1
Та й бог ходив водою.,0
"Але раз він уздрів, що на воді крутиться шум.",-1
"""Хто ти є?""",0
- запитав.,0
"А воно каже: ""Не знаю.",0
"Живий сме, а ходити не можу"".",1
А то був арідник.,0
"Бог про него не знав, бо він був, як бог, з первовіку.",0
"Дав бог йому руки та й ноги, і ходять вже разом оба побратими.",0
"От вкучилось їм все по воді ходити, схотів бог землю зробити, а як дістати з дна моря глини - не знає, бо бог все знав на світі, лише нічого не вмів зробити.",1
"А арідник мав силу до всього - та й каже: ""Я бих туди пронир"".- ""Пронри"".",0
"От він пірнув на дно, згріб в жменю глини, а решту сховав до рота для себе.",-1
"Узяв бог глину, розсіяв.",0
"""Більше нема?""",0
"- (.Нема"".",0
"Поблагословив бог ту землю, та й почала вона рости.",0
"А та, що в роті у сотони, росте й собі.",0
"Росте та й росте, вже й рота розперла, не можна йому дихати вже, очі на лоба лізуть.",0
"""Плюй!""",0
- радить бог.,0
"Зачав він плювати, та й де лиш плюне, там виростають гори, одна вище за другу, до самого неба доходять.",1
"Вони б і небо пробили, коли б бог не закляв.",1
"Відтоді перестали гори рости…

Дивно Іванові, що такі красні гори, такі веселі, а сотворив їх злий.",0
"- Кажи, браччіку, далі,- просить Іван, а Микола знов починав:

- Арідник був здатний до всього, що надумав - зробив.",1
"А бог, як що хотів мати, мусив вимудровувати в нього або украсти.",0
"Поробив арідник вівці, зробив си скрипку і грав, а вівці пасуться.",-1
"Побачив бог та й вкрав тото в него, і вже обоє пастушат.",-1
"Що є на світі - мудрощі, штудерація всяка,- то все від нього, від сотони.",1
"Де що лиш в - віз, кінь, музика, млин або хата,- все вигадав він… А бог лиш крав та давав людям.",-1
"Таке-то…

Раз арідник змерз та й, щоб загрітись, вигадав ватру.",0
Прийшов бог до ватри і дивиться на вогонь.,0
"А той вже знав, чого він.",0
"""Все ти, каже, у мене покрав, а сього не дам"".",0
"Але дивиться арідник, а бог кладе вже ватру.",0
"Так йому стало досадно, що він озьмив та й плюнув у божу ватру.",0
А з тої слини і знявся над вогнем дим.,-1
"Перше ватра була без диму, чиста, а відтоді курить…

Довго Микола оповідає, а коли ненароком згадає чорта, Іван хрестить груди під кептарем.",-1
"Микола ж тоді плює, аби нечистий не мав над ним сили…

x x x
Занедужав Микола - і Іван замість нього пильнує ватри.",-1
"Проти вогню, на лаві, спить ватаг, а там, в кутку, де неспокійно хвилюють тіні од бербениць, постогнує хорий.",-1
"В чорнім котлі кипить вода, дим збивається вгорі, під дах, і вилітає крізь Єонти.",-1
"Часом нечистий дихне у діру, і тоді дим з силою буха та гризе очі, але то добре, бо не можна заснути.",0
А сон налягає.,0
"Щоб одігнати його, Іван встромлює очі в живий вогонь.",1
"Він мусить сокотити вогонь, сю полонинську душу, бо хто знає, що б сталось, якби не вберіг!",-1
Весела грань сміється до Івана з-під важкого накладу і раптом чезне.,-1
"Перед очима пливуть вже зелені плями, розпливаються у царинки, у смерековий ліс.",-1
По царинці ступають білі ноги Марічки.,0
Вона кида в поліг граблі і простягає до нього руки.,0
"І у ту мить, коли Іван ось-ось мав почути м'яке тіло Марічки на своїх грудях, з лісу виходить з риком ведмідь, а білі вівці мечуться вбік і одділяють його од Марічки.",0
"""Ху, пек ті та цур!… Невже заснув?""",0
"Жар з ватри кліпає оком, ватаг хропе, а під чорним покривалом рухливих тіней стогне Микола.",0
Чи не пора варити кулешу на сніданок для вівчарів?,0
Іван виходить з стаї.,0
Тиша і холод обіймають його.,0
"Десь в загородах диха худібка, збились вовною вівці, слабо блищать біля застайок ватри.",0
"Вівчарки обступили Івана, витягують залежане тіло, гребуться і труться до ніг.",0
"Чорні гори залляли долини, як велетенська отара.",-1
"Вони вікують у такій тиші, що чують навіть дихання худоби.",0
"А над ними розстелилося небо, ся полонина небесна, де випасаються зорі, як білі овечки.",1
"Чи ще щось є в світі, опріч сих двох полонин?",1
"Одна послалась долом, друга горою, а між ними, як дрібна цятка, чорніє пастух.",0
"А може, нема нічого.",0
"Може, ніч затопила вже гори, може.",-1
"зсунулись гори, роздушили усе живуще і лиш одно Іванове серце глухо калата під кептарем у безконечних мертвих просторах?",-1
"Самота, як біль зубів, почина ссать йому серце.",-1
"Щось велике, вороже душить його, ся затверділа тиша, байдужний спокій, сей сон небуття.",0
"Нетерплячка стука йому до голови, за горло хапає неспокій-і, стрепенувшись раптом, він з криком, улюлюканням й зойком кида собою у полонину, щоб серед Євалту вівчарок дико ревучим клубком зламати тишу, розбити ніч на скалки, як камінь шибку.",-1
"Ов-ов-во!…- одзиваються збуджені гори… Га-га-га…- повторяють в тривозі далекі верхи, і знову зімкнулась розбита тиша.",0
"Вівчарки вертають назад, скалять до Івана зуби та махають хвостами.",-1
Але зробилось іще сумніше.,0
"Схотілось сонця, веселого шуму ріки, теплого хатнього духу, розмови.",0
"Жаль вхопив серце, солодка туга.",-1
Згадки почали його заливати та хвилюватись перед очима.,-1
"І раптом почув він тихе: ""Іва-а!""",0
Хтось його кликав.,0
О!,0
"Знову: ""Іва-а!…""

Марічка?",0
Де вона взялась?,0
Прийшла на полонину?,0
Вночі?,0
Заблудилась і кличе?,0
"Чи, може, йому причулось?",0
"Ні, вона тут.",0
"Серце калата в Іванових грудях, але він вагається ще.",0
Куди іти?,0
"І знову, утретє, долітає до нього звідкись: ""Іва-а!…"" Марічка… вона… напевно… Він біжить навпростець, без стежки, туди, звідки чув голос, але стрічає лиш прірву, кудою не можна ні збігти, ані дістатись на полонину.",-1
Стоїть й заглядає у чорну безодню.,-1
Тоді йому робиться ясно: се його кличе лісна.,1
"І, хрестячи груди та озираючись лячно, він повертає до стаї.",0
Пора варити кулешу.,0
"В киплячий казан він сипле муку, крає її навхрест, і скоро запашна пара мішається з запахом диму.",-1
Ватаг потягається вже… почина дніти.,0
Але хто його кликав?,0
"А може, то була таки Марічка?",0
"Його тягне подивитися ще, коли стало видніше.",0
Йде в полонину.,0
"Холодні роси сідають йому на постоли, небо зачервонілось, і зблідли зорі.",0
Іван виходить на верх - і раптом холоне.,-1
Де він?,0
Що з ним?,0
Куди ділися гори?,0
"Води обляли кругом полонину, потопили верхи, і полонина пливе самотою в безкрайому морі.",0
"Од Чорногори подихнув вітер, повні води хвилюються стиха, чутно, як невидиме ще сонце росте в глибині, а ось виткнувся з моря весь сивий верх, з якого стікає вода.",1
"Сильніше подиха холод, зростають вали на морі, і верхи, один за другим, пробиваються з білої піни.",-1
Світ наче наново родився.,1
"Води постікали з верхів і ходять вже під ногами, сонце простелило на небі свою корону і ось-ось покаже лице, а з стаї несеться сумний голос трембіти і будить зі сну полонину.",0
"x x x
Так літував Іван у полонині, аж поки вона не спустіла.",0
"Стекла маржинка назад в долини, розібрана хазяями, одтрембітали своє трембіти, лежать здоптані трави, а вітер осінній заводить над ними, як над мерцем.",-1
Лишились тільки ватаг зі спузарем.,0
"Вони мусять чекати, аж згасне вогонь, той вогонь полонинський, що сам народився, неначе бог, сам має й заснути.",0
"А коли і їх вже не стало, на засмучену полонину приволіклась мара та й нипа по стаї й по загородах, чи не лишилось чого для неї.",-1
"x x x
Надаремне Іван поспішав з полонини: він не застав Марічки живою.",1
"За день перед сим, коли брела Черемош, взяла її вода.",0
"Несподівано заскочила повінь, люті габи([26]) збили Марічку з ніг, кинули потім на гоц([27]) і понесли поміж скелі в долину.",-1
"Марічку несла ріка, а люди дивились, як крутять нею габи, чули крики й благання і не могли врятувати.",-1
Іван не вірив.,0
"Се, певно, штуки Гутенюків.",0
Дізнались про їхнє кохання й сховали Марічку.,0
"А коли зо всіх боків чув лиш те саме, рішив шукати тіла.",-1
"Мусило ж прибитись десь до кашіци([28]), десь люди мали його спіймати.",0
"Пішов вздовж річки, повний пекучого гніву і злоби до її вічного шуму, до киплячої люті.",-1
В одному селі знайшов-таки тіло.,0
"Його вже витягли на зарінок, але він не пізнав в ньому Марічки.",0
"Се не Марічка була, а якийсь мокрий лантух, синя кривава маса, стерта річним камінням, як у млині…

Великий жаль вхопив Івана за серце.",-1
"Зразу його тягло скочити з скелі у крутіж: ""На, жери і мене!""",0
"Але потому щемлячий тусок погнав його в гори, далі од річки.",0
"Затуляв вуха, щоб не чути зрадливого шуму, що прийняв в себе останнє дихання його Марічки.",-1
"Блукав по лісі, поміж камінням, в заломах, як ведмідь, що зализує рани, і навіть голод не міг прогнати його в село.",-1
"Знаходив ожини, гогози, пив воду з потоків і тим живився.",-1
Потому щез.,0
"Люди гадали, що він загинув з великого жалю, а дівчата склали співанки про їхнє кохання та смерть, які розійшлися по горах.",0
"Шість літ не було чутки про нього, на сьомий раптом з'явився.",-1
"Худий, зчорнілий, багато старший од своїх літ, але спокійний.",1
"Оповідав, що пастушив на угорському боці.",0
"Ще з рік так походив, а відтак оженився.",0
Треба ж було Єаздувати.,0
"Коли замовкли стріли пістолів і одспівали весілля, а жінка пригнала до загороди вівці й корови, Іван був задоволений навіть.",1
"Його Палагна була з багацького роду, фудульна, здорова дівка, з грубим голосом й воластою шиєю.",0
"Правда, вона любила пишне лудіння, і немало десь піде грошей на шовкові хустки та дорогі згарди, але то байка!",1
"Поглядаючи на овечки, що блеяли в загородах, на свій писаний ботей (стадо), на корови, що дзвонили та рули по випасах в лісі,- він не журився.",0
Тепер він мав коло чого ходити.,0
"Не був жадний багатства - не па те гуцул жиє на світі,- саме плекання маржинки сповняло радістю серце.",1
Як дитина для мами - та кою була для нього худібка.,0
"Весь час, всі думки займала турбота про сіно, про вигоди маржинці, щоб не заслабла, щоб хто не зурочив, щоб вівці щасливо котились, а корови уположались.",0
"Скрізь, од усього була небезпека, і треба було добре глядіти маржину од гадини, звіра і од відьом, які всякими способами потягали манну з коров та потинали худібку.",0
"Треба було багато знати, підкурювать, ворожити, збирати помічне зілля і замовляти.",0
Палагна йому помагала.,0
"З неї була добра Єаздиня, і свої вічні турботи він ділив з нею.",1
- Ну і сусіди дав нам пан-біг!,0
"- жалілась вона чоловікові.- Війшла даві в притулу Хима, глянула на ягнєта та як сплесне в долоні: ""їй!",0
"Які вони файні!""",0
"На, маєш, гадаю собі.",0
"Не встигла та за поріг, а двоє ягнєт закрутилось на місці - та й вже по них… Ігій на тебе, відьмо…

- А я йду сночі,- оповідав Іван,- повз її хату та й дивлюся - кочеється шос кругле, гейби капшук.",0
"Та й світиться так, наче зірниця.",1
"Став я й дивлюся, а воно по царинці, через вориннє та й просто в Химині двері… Абих так здоров був!… Якби був догадався та зняв свої гачі, може б, ними відьму імив, а так пропало…

З другого боку, на найближчім горбі, сусідив Юра.",0
"Про нього люди казали, що він богує.",0
"Він був як бог, знаючий і сильний, той градівник і мольфар.",1
"В своїх дужих руках тримав сили небесні й земні, смерть і життя, здоров'я маржини й людини, його боялись, але потребували усі.",-1
"Траплялось, що і Іван звертався до нього, але за кожним разом, стрічаючи погляд чорних пекучих очей моль-фара, спльовував непомітно: ""Сіль тобі в оці!…""

Проте найгірше докучала їм Хима.",-1
"Стара улеслива баба, завжди така привітна, вона вечорами перекидалась в білого пса та нипала по загородах сусідських.",1
"Не раз Іван метав сокирою в неї, жбурляв вилами та проганяв.",-1
Ряба корова на очах худла і все менше та менше давала подою.,0
"Палагна знала, чия то справа.",0
"Вона підглядала, говорила примівки, по кілька разів на вечір бігала до коров, вставала навіть вночі.",0
"Раз наробила такого крику, що Іван біг в загороду як навіжений і мусив одганяти од порога велику жабу, що намагалась перелізти у хлів.",0
"Але жаба раптом десь щезла, а з-за вориння скрипів вже голосок Химин:

- Добрий вам вечір, сусідоньки красні… хе-хе…

Безвстидна!",0
"Чого вона тільки не виробляла, ота родима відьма!",0
"Перекидалась у полотно, що біліло смерком попід лісом, повзла вужем або котилась горбами прозорим клубком.",1
"Спивала, нарешті, місяць, щоб було темно, як йде до чужої худоби.",0
"Не один присягався, що бачив, як вона терницю доїть: заб'є у неї чотири кілки, неначе дійки,- і надоїть повну дійницю.",0
Скільки клопоту було в Івава!,0
Він не мав навіть коли спам'ятатись.,0
"Ґаздівство потребувало вічної праці, життя маржини так тісно в'язалось з його власним життям, що витісняло всякі інші думки.",1
"Але часами, несподівано зовсім, коли він зводив очі на зелені царинки, де спочивало в копицях сіно, або на глибокий задуманий ліс, звідти злітав до нього давно забутий голос:

Ізгадай мні, мій миленький,
Два рази на днину,
А я тебе ізгадаю
Сім раз на годину…
Тоді він кидав роботу і десь пропадав.",-1
"Фудульна Палагна, що звикла шість день на тиждень робити і тільки в свято одпочивала, пишаючись красним лудінням, сердито дорікала за його примхи.",0
"Але він гнівавсь:

- Заткнися.",0
"Пазь лиш своє і дай мені спокій…

Він сам сердивсь на себе: ""Нащо воно?""",1
- і винувато йшов до худоби.,0
Приносив їй хліба чи грудку солі.,0
"З довірливим риком тяглася до нього його біланя або голубаня, висувала теплий червоний язик і разом з сіллю лизала руки.",0
"Вогкі блискучі очі приязно дивились на нього, а теплий дух молочного вим'я та свіжого гною знову вертали втрачений спокій і рівновагу.",1
"В кошарі його обливало ціле море овець, таких маленьких, круглих.",0
"Вони знали господаря свого, сі барани і ягниці, і з радісним беканням терлись до його ніг.",1
Він запускав пальці в пухнату вовну або з батьківським почуттям брав на руки ягня - і дух полонини віяв тоді над ним та О кликав у гори.,0
Ставало спокійно і тепло на серці.,1
У сьому була Іванова радість.,1
Чи він кохав Палагну?,1
Така думка ніколи не займала його голови.,-1
"Він Єазда, вона Єаздиня, і хоч дітей у них не було, зате була худібка- чого ж ще більше?",0
